{
  "schemaVersion": 1,
  "companies": [
    {
      "id": "company-acme",
      "name": "示例公司",
      "mission": "维护长期配置资产。",
      "boundary": "组织关系不自动授予权限。",
      "departmentIds": ["department-product"],
      "workspaceIds": ["workspace-bandi"],
      "sharedAssetIds": []
    }
  ],
  "departments": [
    {
      "id": "department-product",
      "name": "产品部",
      "companyId": "company-acme",
      "mission": "维护产品配置边界。",
      "members": 1,
      "responsibilities": ["定义长期配置"],
      "boundaries": ["不执行任务"],
      "delegationDepth": 1,
      "memberAgentIds": ["agent-owner"],
      "ownedSopIds": []
    }
  ],
  "roles": [
    {
      "id": "role-owner",
      "companyId": "company-acme",
      "departmentId": "department-product",
      "name": "产品负责人",
      "status": "active",
      "mission": "维护配置管理闭环。",
      "responsibilities": ["确认配置边界"],
      "inputs": [],
      "deliverables": ["配置定义"],
      "decisionBoundaries": ["不扩大权限"],
      "escalationConditions": [],
      "completionDefinition": ["配置可追溯"]
    }
  ],
  "workspaces": [
    {
      "id": "workspace-bandi",
      "name": "Bandi",
      "path": "/tmp/bandi",
      "company": "示例公司",
      "department": "产品部",
      "companyId": "company-acme",
      "primaryDepartmentId": "department-product",
      "projectLeadAgentId": "agent-owner",
      "collaboratorDepartmentIds": [],
      "config": "正常",
      "health": "健康",
      "agentIds": ["agent-owner"],
      "assetIds": [],
      "publicMemorySpaceId": "memory-public",
      "departmentMemorySpaceIds": ["memory-product"],
      "files": [],
      "recentEdits": []
    }
  ],
  "serviceGrants": [
    {
      "id": "grant-review",
      "agentId": "agent-owner",
      "departmentId": "department-product",
      "capabilities": ["配置审查"],
      "workspaceIds": ["workspace-bandi"],
      "prohibitions": ["不得扩大权限"],
      "status": "有效"
    }
  ]
}
